{
  "id": "hunter",
  "name": "Hunter",
  "description": "Keeps the distance a bow was made for, and makes every opening count.",
  "startingWeaponItemId": "hunter_bow",
  "statBonuses": {
    "maxHealth": 20.0,
    "armor": 3.0,
    "poise": 12.0,
    "blockReduction": 0.02,
    "physicalDamage": 0.16,
    "poiseDamage": 0.08,
    "critChance": 0.11,
    "moveSpeed": 0.15,
    "staminaMax": 40.0,
    "staminaRegen": 0.27,
    "manaMax": 25.0,
    "manaRegen": 0.15
  },
  "allowedWeapons": [
    "hunter_bow",
    "crystal_bow",
    "mirebrass_shortbow",
    "rogue_dagger",
    "guard_spear"
  ],
  "allowedWeaponFamilies": [
    "bow",
    "dagger",
    "spear"
  ],
  "perk": "killing_distance",
  "talentBranchId": "mile",
  "rules": [
    {
      "event": "onCrit",
      "effect": "apply_status",
      "statusId": "bleed",
      "stacks": 2,
      "ifWeaponArchetype": "bow",
      "ifTargetDistanceAtLeast": 7.0,
      "chance": 1,
      "cooldown": 0
    },
    {
      "event": "onHit",
      "effect": "restore_stamina",
      "amount": 8,
      "ifWeaponArchetype": "bow",
      "ifTargetDistanceAtLeast": 7.0,
      "chance": 1,
      "cooldown": 0.4
    },
    {
      "event": "onKill",
      "effect": "restore_stamina",
      "amount": 16,
      "chance": 1,
      "cooldown": 0
    },
    {
      "event": "onRoomClear",
      "effect": "bonus_gold",
      "amount": 20,
      "chance": 1,
      "cooldown": 0
    }
  ],
  "iconPath": "class_icons:hunter",
  "role": "CLASS_ROLE_HUNTER",
  "perkName": "CLASS_PERK_KILLING_DISTANCE",
  "perkDescription": "CLASS_PERK_KILLING_DISTANCE_DESC",
  "roleText": "Ranged / Precision",
  "perkNameText": "Killing Distance",
  "perkDescriptionText": "One clean shot pays for the next, and leaves the quarry bleeding for the walk.",
  "perkVerb": "CLASS_PERK_VERB_KILLING_DISTANCE",
  "perkVerbText": "Chain kills into power.",
  "playsLike": "CLASS_PLAYS_LIKE_HUNTER",
  "playsLikeText": "Pick fights at range and let every kill fund the next shot.",
  "statRatings": {
    "maxHealth": 8,
    "armor": 7,
    "poise": 7,
    "blockReduction": 6,
    "physicalDamage": 12,
    "poiseDamage": 8,
    "critChance": 15,
    "moveSpeed": 14,
    "staminaMax": 12,
    "staminaRegen": 13,
    "manaMax": 9,
    "manaRegen": 9
  }
}
